goal,target,code,description,uri
14,14.a,14.a.1,Proportion of total research budget allocated to research in the field of marine technology,/v1/sdg/Indicator/14.a.1
14,14.4,14.4.1,Proportion of fish stocks within biologically sustainable levels,/v1/sdg/Indicator/14.4.1
14,14.b,14.b.1,Degree of application of a legal/regulatory/policy/institutional framework which recognizes and protects access rights for small-scale fisheries,/v1/sdg/Indicator/14.b.1
14,14.5,14.5.1,Coverage of protected areas in relation to marine areas,/v1/sdg/Indicator/14.5.1
14,14.c,14.c.1,"Number of countries making progress in ratifying, accepting and implementing through legal, policy and institutional frameworks, ocean-related instruments that implement international law, as reflected in the United Nations Convention on the Law of the Sea, for the conservation and sustainable use of the oceans and their resources",/v1/sdg/Indicator/14.c.1
15,15.1,15.1.1,Forest area as a proportion of total land area,/v1/sdg/Indicator/15.1.1
15,15.1,15.1.2,"Proportion of important sites for terrestrial and freshwater biodiversity that are covered by protected areas, by ecosystem type",/v1/sdg/Indicator/15.1.2
15,15.2,15.2.1,Progress towards sustainable forest management,/v1/sdg/Indicator/15.2.1
15,15.3,15.3.1,Proportion of land that is degraded over total land area,/v1/sdg/Indicator/15.3.1
15,15.4,15.4.1,Coverage by protected areas of important sites for mountain biodiversity,/v1/sdg/Indicator/15.4.1
15,15.4,15.4.2,(a) Mountain Green Cover Index and (b) proportion of degraded mountain land,/v1/sdg/Indicator/15.4.2
15,15.5,15.5.1,Red List Index,/v1/sdg/Indicator/15.5.1
15,15.6,15.6.1,"Number of countries that have adopted legislative, administrative and policy frameworks to ensure fair and equitable sharing of benefits",/v1/sdg/Indicator/15.6.1
15,15.7,15.7.1,Proportion of traded wildlife that was poached or illicitly trafficked,/v1/sdg/Indicator/15.7.1
15,15.8,15.8.1,Proportion of countries adopting relevant national legislation and adequately resourcing the prevention or control of invasive alien species,/v1/sdg/Indicator/15.8.1
15,15.9,15.9.1,"(a) Number of countries that have established national targets in accordance with or similar to Aichi Biodiversity Target 2 of the Strategic Plan for Biodiversity 2011–2020 in their national biodiversity strategy and action plans and the progress reported towards these targets; and (b) integration of biodiversity into national accounting and reporting systems, defined as implementation of the System of Environmental-Economic Accounting",/v1/sdg/Indicator/15.9.1
15,15.a,15.a.1,(a) Official development assistance on conservation and sustainable use of biodiversity; and (b) revenue generated and finance mobilized from biodiversity-relevant economic instruments,/v1/sdg/Indicator/15.a.1
15,15.b,15.b.1,(a) Official development assistance on conservation and sustainable use of biodiversity; and (b) revenue generated and finance mobilized from biodiversity-relevant economic instruments,/v1/sdg/Indicator/15.b.1
15,15.c,15.c.1,Proportion of traded wildlife that was poached or illicitly trafficked,/v1/sdg/Indicator/15.c.1
16,16.1,16.1.1,"Number of victims of intentional homicide per 100,000 population, by sex and age",/v1/sdg/Indicator/16.1.1
16,16.1,16.1.3,"Proportion of population subjected to (a) physical violence, (b) psychological violence and (c) sexual violence in the previous 12 months",/v1/sdg/Indicator/16.1.3
16,16.1,16.1.4,Proportion of population that feel safe walking alone around the area they live after dark,/v1/sdg/Indicator/16.1.4
16,16.1,16.1.2,"Conflict-related deaths per 100,000 population, by sex, age and cause",/v1/sdg/Indicator/16.1.2
16,16.2,16.2.1,Proportion of children aged 1-17 years who experienced any physical punishment and/or psychological aggression by caregivers in the past month,/v1/sdg/Indicator/16.2.1
16,16.2,16.2.2,"Number of victims of human trafficking per 100,000 population, by sex, age and form of exploitation",/v1/sdg/Indicator/16.2.2
16,16.2,16.2.3,Proportion of young women and men aged 18-29 years who experienced sexual violence by age 18,/v1/sdg/Indicator/16.2.3
16,16.3,16.3.2,Unsentenced detainees as a proportion of overall prison population,/v1/sdg/Indicator/16.3.2
16,16.3,16.3.1,Proportion of victims of violence in the previous 12 months who reported their victimization to competent authorities or other officially recognized conflict resolution mechanisms,/v1/sdg/Indicator/16.3.1
16,16.3,16.3.3,"Proportion of the population who have experienced a dispute in the past two years and who accessed a formal or informal dispute resolution mechanism, by type of mechanism",/v1/sdg/Indicator/16.3.3
16,16.4,16.4.2,"Proportion of seized, found or surrendered arms whose illicit origin or context has been traced or established by a competent authority in line with international instruments",/v1/sdg/Indicator/16.4.2
16,16.4,16.4.1,Total value of inward and outward illicit financial flows (in current United States dollars),/v1/sdg/Indicator/16.4.1
16,16.5,16.5.2,"Proportion of businesses that had at least one contact with a public official and that paid a bribe to a public official, or were asked for a bribe by those public officials during the previous 12 months",/v1/sdg/Indicator/16.5.2
16,16.5,16.5.1,"Proportion of persons who had at least one contact with a public official and who paid a bribe to a public official, or were asked for a bribe by those public officials, during the previous 12 months",/v1/sdg/Indicator/16.5.1
16,16.6,16.6.1,"Primary government expenditures as a proportion of original approved budget, by sector (or by budget codes or similar)",/v1/sdg/Indicator/16.6.1
16,16.6,16.6.2,Proportion of population satisfied with their last experience of public services,/v1/sdg/Indicator/16.6.2
16,16.7,16.7.1,"Proportions of positions in national and local institutions, including (a) the legislatures; (b) the public service; and (c) the judiciary, compared to national distributions, by sex, age, persons with disabilities and population groups",/v1/sdg/Indicator/16.7.1
16,16.7,16.7.2,"Proportion of population who believe decision-making is inclusive and responsive, by sex, age, disability and population group",/v1/sdg/Indicator/16.7.2
16,16.8,16.8.1,Proportion of members and voting rights of developing countries in international organizations,/v1/sdg/Indicator/16.8.1
16,16.9,16.9.1,"Proportion of children under 5 years of age whose births have been registered with a civil authority, by age",/v1/sdg/Indicator/16.9.1
16,16.10,16.10.1,"Number of verified cases of killing, kidnapping, enforced disappearance, arbitrary detention and torture of journalists, associated media personnel, trade unionists and human rights advocates in the previous 12 months",/v1/sdg/Indicator/16.10.1
16,16.10,16.10.2,"Number of countries that adopt and implement constitutional, statutory and/or policy guarantees for public access to information",/v1/sdg/Indicator/16.10.2
16,16.a,16.a.1,Existence of independent national human rights institutions in compliance with the Paris Principles,/v1/sdg/Indicator/16.a.1
16,16.b,16.b.1,Proportion of population reporting having personally felt discriminated against or harassed in the previous 12 months on the basis of a ground of discrimination prohibited under international human rights law,/v1/sdg/Indicator/16.b.1
17,17.1,17.1.1,"Total government revenue as a proportion of GDP, by source",/v1/sdg/Indicator/17.1.1
17,17.1,17.1.2,Proportion of domestic budget funded by domestic taxes,/v1/sdg/Indicator/17.1.2
17,17.2,17.2.1,"Net official development assistance, total and to least developed countries, as a proportion of the Organization for Economic Cooperation and Development (OECD) Development Assistance Committee donors’ gross national income (GNI)",/v1/sdg/Indicator/17.2.1
17,17.3,17.3.2,Volume of remittances (in United States dollars) as a proportion of total GDP,/v1/sdg/Indicator/17.3.2
17,17.3,17.3.1,Additional financial resources mobilized for developing countries from multiple sources,/v1/sdg/Indicator/17.3.1
17,17.4,17.4.1,Debt service as a proportion of exports of goods and services,/v1/sdg/Indicator/17.4.1
17,17.5,17.5.1,"Number of countries that adopt and implement investment promotion regimes for developing countries, including the least developed countries",/v1/sdg/Indicator/17.5.1
17,17.6,17.6.1,"Fixed Internet broadband subscriptions per 100 inhabitants, by speed",/v1/sdg/Indicator/17.6.1
17,17.7,17.7.1,"Total amount of funding for developing countries to promote the development, transfer, dissemination and diffusion of environmentally sound technologies",/v1/sdg/Indicator/17.7.1
17,17.8,17.8.1,Proportion of individuals using the Internet,/v1/sdg/Indicator/17.8.1
17,17.9,17.9.1,"Dollar value of financial and technical assistance (including through North-South, South-South and triangular cooperation) committed to developing countries",/v1/sdg/Indicator/17.9.1
17,17.10,17.10.1,Worldwide weighted tariff-average,/v1/sdg/Indicator/17.10.1
17,17.11,17.11.1,Developing countries’ and least developed countries’ share of global exports,/v1/sdg/Indicator/17.11.1
17,17.12,17.12.1,"Weighted average tariffs faced by developing countries, least developed countries and small island developing States",/v1/sdg/Indicator/17.12.1
17,17.13,17.13.1,Macroeconomic Dashboard,/v1/sdg/Indicator/17.13.1
17,17.14,17.14.1,Number of countries with mechanisms in place to enhance policy coherence of sustainable development,/v1/sdg/Indicator/17.14.1
17,17.15,17.15.1,Extent of use of country-owned results frameworks and planning tools by providers of development cooperation,/v1/sdg/Indicator/17.15.1
17,17.16,17.16.1,Number of countries reporting progress in multi-stakeholder development effectiveness monitoring frameworks that support the achievement of the sustainable development goals,/v1/sdg/Indicator/17.16.1
17,17.17,17.17.1,Amount in United States dollars committed to public-private partnerships for infrastructure,/v1/sdg/Indicator/17.17.1
17,17.18,17.18.2,Number of countries that have national statistical legislation that complies with the Fundamental Principles of Official Statistics,/v1/sdg/Indicator/17.18.2
17,17.18,17.18.3,"Number of countries with a national statistical plan that is fully funded and under implementation, by source of funding",/v1/sdg/Indicator/17.18.3
17,17.18,17.18.1,Statistical capacity indicator for Sustainable Development Goal monitoring,/v1/sdg/Indicator/17.18.1
17,17.19,17.19.1,Dollar value of all resources made available to strengthen statistical capacity in developing countries,/v1/sdg/Indicator/17.19.1
17,17.19,17.19.2,Proportion of countries that (a) have conducted at least one population and housing census in the last 10 years; and (b) have achieved 100 per cent birth registration and 80 per cent death registration,/v1/sdg/Indicator/17.19.2
